<?xml version='1.0' encoding='UTF-8'?>
<model name='cm1' type='composed_model'
    xmlns:xsi='http://www.w3.org/2001/XMLSchema-instance'
    xsi:noNamespaceSchemaLocation='mfmdl.xsd'>
    <model name='m1' type='ponct'>
        <parameter name='p11'><value>1</value><fixed>false</fixed></parameter>
        <parameter name='p12'><value>1</value><fixed>false</fixed></parameter>
        <parameter name='p13'><value>1</value><fixed>false</fixed></parameter>
        <parameter name='p14'><value>1</value><fixed>false</fixed></parameter>
    </model>
    <model name='m2' type='ponct'>
        <parameter name='p21'><value>1</value><fixed>false</fixed></parameter>
        <parameter name='p22'><value>1</value><fixed>false</fixed></parameter>
        <parameter name='p23'><value>1</value><fixed>false</fixed></parameter>
        <parameter name='p24'><value>1</value><fixed>false</fixed></parameter>
    </model>
    <model name='cm2' type='composed_model' >
        <model name='m21' type='ponct'>
            <parameter name='p211'><value>1</value><fixed>false</fixed></parameter>
            <parameter name='p212'><value>1</value><fixed>false</fixed></parameter>
            <parameter name='p213'><value>1</value><fixed>false</fixed></parameter>
            <parameter name='p214'><value>1</value><fixed>false</fixed></parameter>
        </model>
        <model name='m22' type='ponct'>
            <parameter name='p221'><value>1</value><fixed>false</fixed></parameter>
            <parameter name='p222'><value>1</value><fixed>false</fixed></parameter>
            <parameter name='p223'><value>1</value><fixed>false</fixed></parameter>
            <parameter name='p224'><value>1</value><fixed>false</fixed></parameter>
        </model>
        <parameter name='p201'><value>1</value><fixed>false</fixed></parameter>
    </model>
    <model name='m21' type='ponct'>
        <parameter name='p211'><value>1</value><fixed>false</fixed></parameter>
        <parameter name='p212'><value>1</value><fixed>false</fixed></parameter>
        <parameter name='p213'><value>1</value><fixed>false</fixed></parameter>
        <parameter name='p214'><value>1</value><fixed>false</fixed></parameter>
    </model>
    <parameter name='p01'><value>1</value><fixed>false</fixed></parameter>
</model>
